number,pmid,text
58,26822489,"# Accepted Article Preview: Published ahead of advance online publication

![](_page_0_Picture_2.jpeg)

Prefrontal White Matter Structure Mediates the Influence of GAD1 on Working Memory

Tristram A Lett, James L Kennedy, Natasha Radhu, Luis G Dominguez, M Mallar Chakravarty, Arash Nazeri, Faranak Farzan, Henrik Walter, Andreas Heinz, Benoit H Mulsant, Zafiris J Daskalakis, Aristotle N Voineskos

Cite this article as: Tristram A Lett, James L Kennedy, Natasha Radhu, Luis G Dominguez, M Mallar Chakravarty, Arash Nazeri, Faranak Farzan, Henrik Walter, Andreas Heinz, Benoit H Mulsant, Zafiris J Daskalakis, Aristotle N Voineskos, Prefrontal White Matter Structure Mediates the Influence of GAD1 on Working Memory, Neuropsychopharmacology accepted article preview 29 January 2016; doi: 10.1038/npp.2016.14.

This is a PDF file of an unedited peer-reviewed manuscript that has been accepted for publication. NPG are providing this early version of the manuscript as a service to our customers. The manuscript will undergo copyediting, typesetting and a proof review before it is published in its final form. Please note that during the production process errors may be discovered which could affect the content, and all legal disclaimers apply.

Received 10 October 2015; revised 9 January 2016; accepted 25 January 2016; Accepted article preview online 29 January 2016

# Prefrontal White Matter Structure Mediates the Influence of GADI on Working Memory

Tristram A. Lett, PhD12, James L. Kennedy MD234, Natasha Radhu PhD44, Luis G. Dominguez PhD2, M. Mallar Chakravarty PhD55, Arash Nazeri MD22, Faranak, Farzan PhD24, Henrik Walter MD PhD', Andreas Heinz MD PhD', Benoit H. Mulsant MD2-34, Zafiris J. Daskalakis MD PhD2,3,4,7 , Aristotle N. Voineskos MD PhD2,3,4,7

- 1. Department of Psychiatry and Psychotherapy, Charité Universitätsmedizin Berlin, Germany
- 2. Campbell Family Mental Health Institute, Centre for Addiction and Mental Health, Toronto, Canada
- 3. Department of Psychiatry, University of Toronto, Toronto, Canada
- 4. Institute of Medical Science, University of Toronto, Toronto, Canada
- 5. Cerebral Imaging Centre, Douglas Hospital Mental Health University Institute, Verdun, Canada
- 6. Departments of Psychiatry and Biomedical Engineering, McGill University, Montreal, Canada
- Co-senior author 7.

# Keywords

GADI, working memory, schizophrenia, white matter fractional anisotropy, cortical inhibition, imaging-genetics

Word Count: 3796 Abstract Word Count: 245 Figures: 3 Tables: 2 Supplementary Material:

# Running Title

GAD1 predicts brain structure and inhibition

# \*Corresponding Author

Aristotle N. Voineskos, M.D., Ph.D., FRCP Email: Aristotle. Voineskos@camh.ca Phone: 416-535-8501x4378 Kimel Family Translational Imaging-Genetics Laboratory, Research Imaging Centre Campbell Family Mental Health Institute, Centre for Addiction and Mental Health, 250 College Street, Toronto, Ontario, Canada M5T1R8

## Abstract

The glutamic acid decarboxylase 1 (GAD1) gene is a major determinant of y-Aminobutyric acid (GABA), the most abundant inhibitory neurotransmitter modulating local neuronal circuitry. GABAergic dysfunction and expression of GAD1 have been implicated in the pathophysiology of schizophrenia, and in working memory impairment. We examined the influence of the functional GADI rs3749034 variant on white matter fractional anisotropy (FA), cortical thickness, and working memory performance in schizophrenia patients and healthy controls (N=197). Using transcranial magnetic stimulation with electroencephalography (TMS-EEG), we subsequently examined the effect of rs3749034 on long-interval cortical inhibition (LICI) in the dorsolateral prefrontal cortex (DLPFC) in schizophrenia patients and healthy controls (N=66). We found that the rs3749034 T-allele carrier risk group had lower voxel-wise FA in prefrontal cortex region (PFWE-corrected (0.05) but not cortical thickness. Mixed-model regression revealed a significant effect on attentional processing and working memory across four performance measures (F1.182=11.5, p=8x10""). FA in the prefrontal cortex was associated with digit-span performance. Voxel-wise mediation analysis revealed that the effect GAD1 on poorer digit-span performance statistically predicted the lower white matter FA (PFWE-orrected <0.05). In exploratory analysis, we found a prominent GADI genotype-by-diagnosis interaction on DLPFC LICI (F1.56=14.3, p=4.1x10 ). Our findings converge on variation in GADI gene predicting a susceptibility mechanism that affects white matter FA, GABAergic inhibitory neurotransmission in the DLPFC, and working memory performance. Furthermore, via voxel mediation of FA and TMS-EEG intervention, we provide evidence for a potentially causal mechanism through which aberrant DLPFC GABA signaling may contribute to working memory dysfunction.

Tristram A. Lett

## Introduction

Working memory dysfunction is a central feature of schizophrenia and other psychiatric disorders. In patients with schizophrenia, working memory deficits are associated with dysfunction of dorsolateral prefrontal cortex (DLPFC) connectivity, and disruption of neurotransmitter input such as y-Aminobutyric acid (GABA) inhibitory neurotransmission (Lewis et al, 2012). There is a genetic contribution to working memory dysfunction. Unaffected co-twins of schizophrenia patients perform significantly worse than controls on spatial and verbal working memory tasks (Pirkola et al, 2005). For example, the letter-number-sequencing task (LNS; a measure of working memory) has been identified as an endophenotype of schizophrenia with a moderately high heritability (h2=0.39) (Greenwood et al, 2007).

Heritability studies have also demonstrated that prefrontal and temporal gray matter volumes are strongly influenced by genetics factors in comparison to other regions of the cortex (Thompson et al, 2001). Diffusion tensor imaging (DTI) heritability studies generally reported the greatest impact of genetic factors on fractional anisotropy (FA) in cingulate gyrus, uncinate fasciculi, and the corpus callosum (Kochunov et al, 2014). Together, this suggests that the working memory functioning is mediated, in part, by genetic factors driving brain structure and function. However, it could be argued that imaging-genetics studies of working memory are intrinsically correlational, showing only associations among genetic variants, brain structure and cognitive performance (Kanai and Rees, 2011). To date, few studies have examined if the genetic contribution to working memory is mediated by brain structure (Aarts et al, 2010; Green et al, 2013; Klumpers et al, 2014), and none have examined whole brain relationships.

One method that may resolve the causal relationship among genes, brain structure and working memory performance is transcranial magnetic stimulation with electroencephalography (TMS-3 Tristram A. Lett

EEG). Combined TMS-EEG applied over the DLPFC can be used to measure the effects of GABAergic inhibitory neurotransmission on neural oscillations and synchrony that are thought to be integral to higher order cognitive function including working memory (Daskalakis et al, 2008; Lett et al, 2014; McClintock et al, 2011). Paired-pulse cortical stimulation can elicit cortical inhibition or facilitation that is suggested to underlie neurotransmission at the synapse. In particular, long-interval cortical inhibition (LICI) has been linked to metabotropic GABAB receptor transmission (Deisz, 1999; McDonnell et al, 2006). DLPFC LICI has been correlated with performance on the N-back (r=0.63), LNS (r=0.68), and Sternberg (accuracy: r=0.58; reaction time: r=0.48) working memory tasks in healthy controls (Daskalakis et al, 2008; Hoppenbrouwers et al, 2012; Rogasch et al, 2014). Therefore, DLPFC LICI may represent an important mechanism linking GABAergic inhibitory neurotransmission and working memory performance.

Convergent evidence suggests a compelling role for the glutamate decarboxylase 1 (GADI) gene in GABAergic neurotransmission as it relates to working memory. GADI codes for the glutamic acid decarboxylase (GADG) enzyme that metabolizes glutamate to GABA and is responsible for the production of the majority of GABA in the brain (Lewis et al, 2005), although activityinduced GABA synthesis has been shown to be induced by GAD65 (Patel et al, 2006). Downregulation of GAD67 in the parvalbumin-positive (PV) interneurons of the DLFPC is a well-replicated postmortem finding in schizophrenia (Torrey et al, 2005). In the mouse PFC, GADo deficits in the parvalbumin interneurons have been causally linked to inhibitory transmission and network disinhibition (Lazarus et al, 2013). Given the linkage disequilibrium structure of GADI, the rs3749034 single nucleotide polymorphism (SNP) covers a large proportion of the variance in the promoter/5' region; rs3749034 has been associated with

Tristram A. Lett

downregulation of GAD67 in the DLPFC as well as the progressive switch from GAD25 to GAD67 expression and KCC2 to NKCC1 expression (Hyde et al, 2011; Straub et al, 2007). This switch is thought to be the hallmark of the shift from GABA excitatory function to inhibitory function underlying synaptic wiring and refinement of local neuronal circuits (Ben-Ari et al, 2012). Furthermore, a 5 '-promoter SNP in linkage disequilibrium with rs3749034 is associated with variation in working memory performance and DLPFC function in vivo (Straub et al, 2007). Therefore, the GAD1 rs3749034 SNP may reflect changes in cortical connectivity and local inhibitory circuits that are involved in working memory performance.

In the present study, we set out to provide convergent evidence that the relationship between GADI and working memory performance may be mediated by brain structural connectivity and DLPFC inhibitory neurotransmission. Since GADI is expressed ubiquitously expressed across the cortex, we examined whole brain associations of cortical thickness and white matter FA connecting these cortical regions. Further, it is unclear if GAD1 would predict specific working memory domains or general executive functioning. Therefore, we tested associations among the GADI promoter variant rs3749034 neurocognitive tasks spanning attention in addition to verbal and non-verbal components of working memory. Using LICI, we explored the association among the rs3749034 SNP and DLPFC cortical inhibition.

## Materials and Methods

#### Participants

Two independent samples were examined. Participants for both the imaging-genetics sample and the TMS-EEG sample were recruited under separate study protocols approved by the Centre for Addiction and Mental Health (CAMH) in Toronto, Canada in accordance with the Declaration in Tristram A. Lett 5

Helsinki. All participants were identified as Caucasian based on self-reported ethnicity of three out of four grandparents. They were administered the Structured Clinical Interview for DSM-IV Disorders (First MB, 1995), and were interviewed by a psychiatrist to ensure diagnostic accuracy. Individuals with previous head trauma with loss of consciousness, neurological disorders, current or past substance and a history of a primary psychotic disorder in first-degree relatives were excluded.

For the imaging-genetics sample, all clinical assessments occurred at CAMH while T1-weighted and diffusion-weighted magnetic resonance imaging (DW-MRI) scans were performed at a nearby general hospital. Eighty patients with a diagnosis of schizophrenia or schizoaffective disorder and 115 healthy control subjects in this sample completed all imaging and genetics protocols; three healthy controls did not complete DW-MRI protocols. Seventy patients and 121 healthy controls completed cognitive testing, and genetics protocols. IQ was measured using the Wechsler Test for Adult Reading (WTAR) (Wechsler, 2001) and all participants were screened with the Mini Mental Status Exam (MMSE) for dementia (Folstein et al, 1975) and a urine toxicology screen. The Hand Dominance Questionnaire was used to examine handedness. Comorbid physical illness burden was measured by administration of the Clinical Information Rating Scale for Geriatrics (CIRS-G) (Miller et al, 1992). All subjects underwent a battery of cognitive test that been previously described (Voineskos et al, 2012). See supplement 1 for detail on the assessment of working memory.

For the TMS-EEG sample, all clinical assessments and TMS-EEG recordings occurred at CAMH. The sample has been described previously (Radhu et al, 2015). For the purpose of this study, only participants of Caucasian ethnicity were included in the analysis resulting in 33 healthy control and 23 patients with a diagnosis of schizophrenia or schizoaffective disorder with Tristram A. Lett 6

completed TMS-EEG and genetics protocols. Exclusion criteria established by international safety standards for TMS were followed (Rossi et al, 2009). The TMS adult Safety Screen was administered to all subjects (Keel et al, 2001).

## Genetics

Genotyping of the rs3749034 variant (GADI) was performed using a standard ABI (Applied Biosystems Inc.) 5' nuclease Taqman assay-on-demand protocol in a total volume of 10 µL. Postamplification products were analyzed on the ABI 7500 Sequence Detection System (ABI, Foster City, California, USA) and genotype calls were performed manually. Results were verified independently by laboratory personnel blind to demographic and phenotypic information. Genotyping accuracy was assessed by repeating 10% of the sample with 100% accordance in all genotype calls.

### Image Acquisition

High-resolution axial inversion recovery-prepared spoiled gradient recall MR images were acquired using a 1.5-T GE Echospeed system (General Electric Medical Systems, Milwaukee, WI; echo time (TE): 5.3 ms, repetition time (TR): 12.3 ms, time to inversion: 300 ms, flip angle 20, number of excitations=1; 124 contiguous images, 1.5 mm thickness). For DW-MRI acquisition, a single-shot spin-echo planar sequence was used with diffusion gradients applied in 23 non-collinear directions, b=1000 s/mm², and two b=0 images. Fifty-seven slices were acquired for whole-brain coverage oblique to the axial plane (2.6 mm isotropic voxels; field of view was 330 mm, 128 × 128 mm2 acquisition matrix; TE=85.5 ms, TR=15 000 ms; the sequence was repeated three times to improve signal-to-noise ratio). Quality control for each raw diffusion-weighted scan was conducted manually by an experienced operator prior to inclusion 7 Tristram A. Lett

of the images into the research study. Each scan was visually inspected for artifacts or motion including: horizontal stripes, checker effects, inter-slice intensity. Cortical thickness mapping and tract-based spatial statistics are explain in detail in Supplement 1, methods and materials.

#### Cluster-based measure of long-interval cortical inhibition

LICI was assessed among all electrodes at frequencies ranging from 1-50 Hz. Cluster-based analysis has been previously described in detail in this sample (Garcia Dominguez et al, 2014; Radhu et al, 2015), and based on analyses described by Maris and Oostenveld (Maris and Oostenveld, 2007). Clusters are defined in a time-frequency-space domain, a 4-dimensional entity, since space is the two dimensional grid of electrodes plus one dimension for time and another for frequency. Cortical inhibition was assessed at every time-frequency-spatial value using a one-tailed, paired t-test testing if the single-pulse condition was significantly greater than the paired-pulse stimulation. The significant threshold was set at a<0.01 after 10,000 permutations of trials from the two conditions, paired and single pulse. The number of significant voxels within the biggest cluster of inhibition was calculated for every subject, and it was determined as the degree of LICI after stimulation to the DLPFC. This measure of DLPFC LICI was left-skewed, therefore we applied a log transformation. See Supplement 1 for detail on localization of the DLPFC for TMS-EEG, LICI assessment, EEG recording and processing.

## Statistics

Given the low frequency of the TT genotype, these cases were grouped with CT genotypes and referred to as 'T allele carriers' for all statistical tests (Table S1). Analyses were performed examining the relationship between GADI genotype group (C allele homozygotes or T allele 8 Tristram A. Lett

carriers) for cognitive performance, brain morphology and DLPFC LICI. Adherence to Hardy-Weinberg equilibrium and case-control allelic frequency association (using x) were determined using Haploview 4.2.

Differences in demographic characteristics between healthy controls and schizophrenia patients were assessed by independent t-tests for continuous variables and x2 tests for count variables using SPSS (Version 21). For cortical thickness and tract-based spatial statistics (TBSS) analyzes, we examined a diagnosis by GADI genotype interaction, and main effects of diagnosis and genotype on the FA skeleton with age and sex as covariates. A false discovery rate (FDR) correction of q=0.05 was applied for cortical thickness, and a family-wise error (FWE) rate of 5% for white matter FA comparisons. Multiple comparison corrections were performed within each analytic imaging modality.

To determine potential confounders of working memory, we first evaluated if age, sex, IQ, and three measures of education (participant, father, mother) were predictors of task performance (LNS, digit-span) in healthy controls or schizophrenia patients via the linear mixed model. Task performance scores were the within-subject variable. GAD1 genotype, diagnosis, and their interaction were the between-subject factors. Follow-up analysis was done using the general linear model (GLM). Covariates of no interests were only included in our model if they were below a significance threshold of p = 0.1. The influence of GADI as a predictor of cognitive performance, diagnosis, and their interaction was then analyzed via the GLM with our covariates of no interest. Four GLMs were performed with LNS score, Digit-Span, Stroop (Time/Item), and Stroop ratio. Associations were deemed significant at P=0.05 after Bonferroni correction for four comparisons.
#### Voxel-wise mediation analysis

Mediation was assessed at each FA voxel from the TBSS skeleton. GAD1 rs3749034 genotype was the independent variable, neurocognitive performance was the dependent variable, and each FA voxel was the mediator. Age, sex, and diagnosis were included as covariates. Significant mediation was assessed via the Sobel Z statistic at each voxel creating a TBSS skeleton map of Sobel Z statistics that then under-went threshold-free clustering enhancement (TFCE). Significant after family-wise correction was assessed by maximum whole skeleton TFCE value from 10000 permutations (randomization). See Supplement 1 for a detailed description of the voxel-wise mediation analysis.

### Results

#### Participants

There was no significant deviation from Hardy-Weinberg equilibrium for the rs3749034 genotype (p=1; Table S1). The rs3749034 minor allele frequency of the healthy controls (0.22) was similar to Hapmap CEU population (0.18; Hapmap Build #27) (Gibbs et al, 2003). The frequency of the rs3749034 T allele was significantly greater in schizophrenia patients (0.29) than controls (0.22, x =3.8, p=0.05), and the association is in the same direction as the most recent findings from the Psychiatric Genomics Consortium (T risk allele; p=0.007)(Schizophrenia Working Group of the Psychiatric Genomics, 2014). For both samples, age, sex, and handedness were not significantly different between schizophrenia patients and healthy controls (p>0.05). In the imaging-genetics sample, patients had lower IQ, education, and highest level of education of either parent (p<0.05; Table 1).

#### Association between GAD1 and brain structure

We found no effect of genotype or genotype by diagnosis interaction at any cortical thickness vertex after covarying for age and using FDR correction of 5%. We found a significant main effect in which T allele risk carries were associated with lower FA, predominately in the prefrontal cortex including the genu of the corpus callosum (PrwE-corrected>0.05; Figure S1). There was no significant GADI genotype-by-diagnosis interaction on FA after correcting for FWE.

### Association between GAD1 and neurocognitive performance

We included age and IQ as covariates of no interest in our analyses since they were significantly associated with our working memory outcome measures (Digit-Span and LNS) in schizophrenia patients and healthy controls (p<0.05). Sex and education were not associated with digit-span forward or LNS performance in either patients or controls (p>0.1); therefore, they were not included in as covariates. In a linear mixed model, we included performance of our four cognitive measures (digit-span forward, LNS, Stroop time/item, Stroop Ratio) as within-subject variables because of the correlation among these performance scores in healthy controls and schizophrenia patients (Supplementary Table S3).

There was a significant between-subject effect of GAD1 genotype (F1.182=11.5, p=8 x 10+), but no significant genotype-by-diagnosis interaction (F1,182-2.3, p=0.13). Further, there was a significant within-subject effect (task-by-genotype) association with GADI genotype (p=0.03). Follow-up analyses in each task revealed a significant effect of GADI on digit-span forward performance (F1.188 = 7=8.0, p=0.005) and a nominally significant effect on the LNS task performance (F1188 = 5.0, p=0.026), after covarying for subject age and IQ. There also was a Tristram A. Lett 11

significant association with Stroop ratio (F11188=7.0, p=0.009), but not time per item. No significant GADI genotype-by-diagnosis interaction was observed for any cognitive task (Table 2, Supplementary Figure S2).

#### Voxel-wise mediation analysis

Since there was a significant association between main effect of GADI risk genotype and white matter FA as well as working memory, we employed voxel-wise mediation analysis across all subjects. For mediation to occur, we first needed to establish if white matter FA predicted working memory performance (corrected for IQ). Voxel-wise analysis of the TBSS skeleton revealed higher FA was associated with better digit-span forward performance after covarying for the effect of age, particularly in the corpus callosum and the right superior longitudinal fasciculus (PFWE-corected 0.05; Figure S3). FA did not predict LNS performance or Stroop ratio after correcting for family-wise error; therefore, we did not perform any mediation analyses for these tasks. White matter skeleton FA mediated the association between GAD1 risk genotype and digit-span performance, particularly in the prefrontal and right inferior parietal regions, suggesting that lower FA in this regions is statistically causing poorer digit-span performance (PFWE-corrected<0.05; Figure 2).

#### Long-interval cortical inhibition

In the TMS-EEG sample, GAD1 genotype and diagnosis were not associated with DLPFC LICI cluster size (GADI genotype: F156=0.6, p= 0.43; diagnosis: F1.56=1.7, p=0.20); however, we found a prominent GADI genotype-by-diagnosis interaction explaining 22% of the variance in LICI DLPFC cluster size (R2=0.22, F156=13.5, p=4.2x104; Figure 3). Given the significant genotype-by-diagnosis interaction we examined the association between GAD1 and LICI cluster Tristram A. Lett 12

size separately in healthy controls and patients with schizophrenia. In healthy controls, GADI risk genotype predicted greater DLPFC LICI cluster size (R2-0.25, F1.33=10.1, p=0.003). In contrast, GAD1 risk genotype was associated with lower DLPFC LICI cluster size in patients with schizophrenia (R2=0.19, F1.23=5.4, p=0.04).

#### Discussion

We have provided evidence that the GAD1 rs3749034 risk variant is associated with lower white matter FA that may be related to poor working memory performance and frontal executive functioning that is independent of diagnosis. Carriers of the GADI risk allele had poorer working memory, and lower white matter FA in the prefrontal cortices. Furthermore, our exploratory analysis indicates that the GAD1 risk variant differentially predicts DLPFC LICI depending on diagnosis. Last, white matter FA positively correlates with digit-span performance independent of diagnosis, and we could statistically infer a causal relationship via white matter FA mediates the effect on GAD1 on digit-span performance.

To the best of our knowledge, our study is the first to examine the effect of rs3749034 genotype on white matter FA. Our finding that T-allele risk carriers predicted lower FA, predominately in the genu of the corpus callosum, is consistent with the literature on top-down modulation of posterior brain regions during inhibition and attention tasks (Hopfinger et al, 2000). The T-allele was also associated with worse performance on both the working memory tasks and the Stroop reaction time. This may suggest that the effect of GADI genotype may be acting on general frontal executive function rather than working memory specifically. This is bolstered by the association of genotype with prefrontal FA, and is line with the concept that genetic variation can delineate brain structure or function that is common among multiple cognitive functions.

Furthermore, we found the effect of rs3749034 on FA and working memory performance was consistent across diagnostic groups. This suggests that genotypic variation in GADI acts as a modifier of brain structure and related cognitive function. GAD1 may explain some of the heterogeneity of brain structure and cognitive function reported within schizophrenia, despite the potential confounders within disease. While our vertex-wise analysis did not replicate previous association between the GADI risk variant and the left parahippocampus (Brauns et al, 2013), our exploratory analysis revealed that the GADI risk variant may be associated with temporal lobe cortical thickness although the effects may be modest. Replication is necessary to confirm the association.

This study is also the first to examine the effect of genetic variation on DLPFC LICI. Our exploratory TMS-EEG analysis yielded an unexpected result. In healthy controls, GADI T allele carriers had greater LICI cluster size in contrast to schizophrenia patients in which T allele carriers had lower cluster size. One speculative explanation could be that in healthy controls, T allele carriers have less efficient LICI and need to incorporate more cortical areas to achieve the same inhibition. In contrast, schizophrenia patients may have reduced prefrontal connectivity, and the T allele carriers are unable to elicit a LICI response to wider area. The link between disrupted GABA synthesis and GABAB receptor function, which is primarily measured by LICI, is not completely elucidated yet. Furthermore, the association among GADI genotype and LICI may be reliant on other neurotransmitter systems disrupted in schizophrenia. GABAA receptor neurotransmission generates a tonic conductance, in addition to phasic activations, suggesting that LICI may also index efficient GABAA receptor functioning (Farrant and Nusser, 2005). Additionally, in vivo NDMA receptor agonist treatment leads to reduced GAD1 expression suggesting upstream control of inhibition (Lisman et al, 2008). GABAx receptor and NMDA

receptor abnormalities observed in schizophrenia could explain the opposite effect of GADI genotype on LICI cluster size in healthy controls and schizophrenia patients (Akbarian et al, 1995; Uhlhaas and Singer, 2010). However, it is important to be remain cautious about these interpretations given the exploratory nature of the analysis.

Our finding may have clinical implications in the treatment of working memory dysfunction in schizophrenia. Currently, there are no currently approved treatments that are clinically effective although some preclinical studies have shown effects of brain stimulation. For example, it has been reported that bilateral rTMS treatment to the DLPFC might improve working memory performance in schizophrenia patients (Barr et al, 2013). Also, long-term rTMS treatment was associated with increased prefrontal white matter FA (Allendorfer et al, 2012; Peng et al, 2012). Cortical inhibition has been suggested to explain the lasting effects of rTMS (Daskalakis et al, 2006; Funke and Benali, 2011). Therefore, GADY genotype could predict a direct mechanistic link between rTMS treatment and DLPFC LICI. Furthermore, cognitive remediation therapy (CRT) may ameliorate working memory dysfunction in schizophrenia. Considering our associations among GADI, prefrontal cortex white matter FA, DLPFC LICI, and working memory, it could be speculated that GAD1 rs3749034 genotype may be an important genetic predictor of adjunctive treatments such as rTMS. GADI rs3749034 genotype may be a potential confounder in future treatment trials, and therefore, segregating subjects by genotype may improve trial outcome.

This study has a number of limitations. Even though we found a significant association between rs3749034 and schizophrenia, evidence for association between GADI common variants and schizophrenia is relatively weak with no reported genome-wide significant findings. However, there is strong evidence for disruption of GADI expression in schizophrenia. Our a priori Tristram A. Lett 15

hypothesis was that GADI is an important modifier of the disease process, and we selected the rs3749034 based on its known effect on GAD1 expression. That is, we sought to indirectly model for how altered GADI expression may lead to neuroanatomical, neurophysiological, and neurocognitive differences. Since the minor allele frequency of the rs3749034 variant is relatively low, for statistical analysis we inferred a dominant model by grouping minor allele risk homozygotes and heterozygotes. We limited our analysis only to Caucasian subjects; therefore, we are unable to assess the effect of GADI in other ethnic groups. There were differences in the education level of the parents as well as in IQ between groups which may limit the generalizability for our results. Moreover, the exploratory LICI analysis was performed in a small sample for genetic analysis and subjects were not assessed for working memory performance. Thus, we could not directly assess the relationship among GAD1, LICI, and working memory. Correlations between LICI and working memory has been independently replicated in three healthy control samples (Daskalakis et al, 2008; Hoppenbrouwers et al, 2012; Rogasch et al, 2014). However, this relationship has not been assessed in patients with schizophrenia, and as such our results may help inform molecular or neurophysiologicallyinformed treatment translation efforts to enhance cognitive performance based on GADI genotype.

Working memory dysfunction is one of the most intractable symptoms of schizophrenia, with severe consequences on functional outcome (Lett et al, 2014). We have provided evidence that GADI may mediate lower working memory function via changes in white matter FA in the prefrontal cortex, and LICI after DLPFC stimulation. Thus, GADI on brain structure and function may explain some of the heterogeneity in working memory dysfunction. In addition, our

results suggest a genetic relationship between inhibitory signaling and working memory dysfunction among healthy individuals and schizophrenia patients.

Accorporal manuscript

### Acknowledgements

This study is supported by a Canadian Institute of Health Research (CIHR) Fellowship (Dr. Lett). Dr. Voineskos is supported by the Centre for Addiction and Mental Health (CAMH) Foundation (Kimel Family, Koerner New Scientist Award, and Paul E. Garfinkel New Investigator Catalyst Award); Ontario Mental Health Foundation (OMHF); Brain and Behaviour Research Foundation; National Institute of Mental Health. Dr. Daskalakis is supported by OMHF, CIHR, the Brain and Behaviour Research Foundation and the Temerty Family and Grant Family, and through the CAMH Foundation and the Campbell Institute. Dr. Chakravarty is supported by the BIHR, National Sciences and Engineering Research Council of Canada, Weston Brain Institute, Alzheimer's Society, Michael J. Fox Foundation for Parkinson's Research, Brain Canada, and Fonds de Recherche Sante Quebec. Dr. Nazeri is supported by a CAMH Fellowship. Dr. Radhu is supported by an OMHF studentship.

#### Financial Disclosures

Dr. Daskalakis has received research and equipment in-kind support for an investigator-initiated study through Brainsway Inc. He has also served on the advisory board for Hoffmann-La Roche Limited and Merck and received speaker support from Sepracor and Eli Lilly. Dr. Walter has received speaker fees from Servier. Dr. Kennedy is a Scientific Advisory Board member (unpaid) of AssureRx Health Inc., received speaker honoraria and expenses from Eli Lilly, Novartis and Shire, and consultant honoraria from Roche. Dr. Mulsant has received medications for NIH-funded clinical trials from Bristol-Myers Squibb, Pfizer, and Eli-Lilly. Drs. Lett, Radhu, Dominguez, Chakravarty, Nazeri, Farzan, Heinz, and Voineskos report no biomedical financial interests or potential conflicts of interest.

Supplementary information is available at the Neuropsychopharmacology website.

## References

Aarts E, Roelofs A, Franke B, Rijpkema M, Fernandez G, Helmich RC, et al (2010). Striatal dopamine mediates the interface between motivational and cognitive control in humans: evidence from genetic imaging. Neuropsychopharmacology 35(9): 1943-1951.

Akbarian S, Huntsman MM, Kim JJ, Tafazzoli A, Potkin SG, Bunney WE, Jr., et al (1995). GABAA receptor subunit gene expression in human prefrontal cortex: comparison of schizophrenics and controls. Cerebral cortex 5(6): 550-560.

Allendorfer JB, Storrs JM, Szaflarski JP (2012). Changes in white matter integrity follow excitatory rTMS treatment of post-stroke aphasia. Restorative neurology and neuroscience 30(2): 103-113.

Barr MS, Farzan F, Rajji TK, Voineskos AN, Blumberger DM, Arenovich T, et al (2013). Can repetitive magnetic stimulation improve cognition in schizophrenia? Pilot data from a randomized controlled trial. Biol Psychiatry 73(6): 510-517.

Ben-Ari Y, Khalilov I, Kahle KT, Cherubini E (2012). The GABA excitatory/inhibitory shift in brain maturation and neurological disorders. The Neuroscientist : a review journal bringing neurobiology, neurology and psychiatry 18(5): 467-486.

Brauns S, Gollub RL, Walton E, Hass J, Smolka MN, White T, et al (2013). Genetic variation in GAD1 is associated with cortical thickness in the parahippocampal gyrus. Journal of psychiatric research 47(7): 872-879.

Daskalakis ZJ, Farzan F, Barr MS, Rusjan PM, Favalli G, Levinson AJ, et al (2008). Evaluating the relationship between long interval cortical inhibition, working memory and gamma band activity in the dorsolateral prefrontal cortex. Clinical EEG and Neuroscience 39(3): 150-155.

Daskalakis ZJ, Moller B, Christensen BK, Fitzgerald PB, Gunraj C, Chen R (2006). The effects of repetitive transcranial magnetic stimulation on cortical inhibition in healthy human subjects. Experimental brain research 174(3): 403-412.

Deisz R (1999). GABA< sub> B</sub> receptor-mediated effects in human and rat neocortical neurones in vitro. Neuropharmacology 38(11): 1755-1766.

Farrant M, Nusser Z (2005). Variations on an inhibitory theme: phasic and tonic activation of GABA(A) receptors. Nat Rev Neurosci 6(3): 215-229.

First MB SR, Gibbon M, Williams JBW (1995). Strucutured Clinical Interview for DSM-IV Axis I Disorders, Patient Edition (SCID-P), version 2. Biometrics Research: New York.

Folstein MF, Folstein SE, McHugh PR (1975). ""Mini-mental state"". A practical method for grading the cognitive state of patients for the clinician. Journal of psychiatric research 12(3): 189-198.
Funke K, Benali A (2011). Modulation of cortical inhibition by rTMS - findings obtained from animal models. The Journal of physiology 589(Pt 18): 4423-4435.

Garcia Dominguez L, Radhu N, Farzan F, Daskalakis ZJ (2014). Characterizing long interval cortical inhibition over the time-frequency domain. PloS one 9(3): e92354.

Gibbs RA, Belmont JW, Hardenbol P, Willis TD, Yu F, Yang H, et al (2003). The international HapMap project. Nature 426(6968): 789-796.

Green AE, Kraemer DJ, Deyoung CG, Fossella JA, Gray JR (2013). A gene-brain-cognition pathway: prefrontal activity mediates the effect of COMT on cognitive control and IQ. Cerebral cortex 23(3): 552-559.

Greenwood TA, Braff DL, Light GA, Cadenhead KS, Calkins ME, Dobie DJ, et al (2007). Initial heritability analyses of endophenotypic measures for schizophrenia: the consortium on the genetics of schizophrenia. Archives of general psychiatry 64(11): 1242-1250.

Hopfinger JB, Buonocore MH, Mangun GR (2000). The neural mechanisms of top-down attentional control. Nature neuroscience 3(3): 284-291.

Hoppenbrouwers SS, De Jesus DR, Stirpe T, Fitzgerald PB, Voineskos AN, Schutter DJLG, et al (2012). Inhibitory deficits in the dorsolateral prefrontal cortex in psychopathic offenders. Cortex.

Hyde TM, Lipska BK, Ali T, Mathew SV, Law AJ, Metitiri OE, et al (2011). Expression of GABA signaling molecules KCC2, NKCC1, and GAD1 in cortical development and schizophrenia. J Neurosci 31(30): 11088-11095.

Kanai R, Rees G (2011). The structural basis of inter-individual differences in human behaviour and cognition. Nat Rev Neurosci 12(4): 231-242.

Keel JC, Smith MJ, Wassermann EM (2001). A safety screening questionnaire for transcranial magnetic stimulation. Clinical neurophysiology : official journal of the International Federation of Clinical Neurophysiology 112(4): 720.

Klumpers F, Kroes MC, Heitland I, Everaerd D, Akkermans SE, Oosting RS, et al (2014). Dorsomedial Prefrontal Cortex Mediates the Impact of Serotonin Transporter Linked Polymorphic Region Genotype on Anticipatory Threat Reactions. Biol Psychiatry.

Kochunov P, Jahanshad N, Sprooten E, Nichols TE, Mandl RC, Almasy L, et al (2014). Multisite study of additive genetic effects on fractional anisotropy of cerebral white matter: Comparing meta and megaanalytical approaches for data pooling. Neuroimage 95: 136-150.

Lazarus MS, Krishnan K, Huang ZJ (2013). GAD67 Deficiency in Parvalbumin Interneurons Produces Deficits in Inhibitory Transmission and Network Disinhibition in Mouse Prefrontal Cortex. Cerebral cortex.

Tristram A. Lett

Lett TA, Voineskos AN, Kennedy JL, Levine B, Daskalakis ZJ (2014). Treating Working Memory Deficits in Schizophrenia: A Review of the Neurobiology. Biol Psychiatry 75(5): 361-370.

Lewis DA, Curley AA, Glausier JR, Volk DW (2012). Cortical parvalbumin interneurons and cognitive dysfunction in schizophrenia. Trends in neurosciences 35(1): 57-67.

Lewis DA, Hashimoto T, Volk DW (2005). Cortical inhibitory neurons and schizophrenia. Nat Rev Neurosci 6(4): 312-324.

Lisman JE, Coyle JT, Green RW, Javitt DC, Benes FM, Heckers S, et al (2008). Circuit-based framework for understanding neurotransmitter and risk gene interactions in schizophrenia. Trends in neurosciences 31(5): 234-242.

Maris E, Oostenveld R (2007). Nonparametric statistical testing of EEG- and MEG-data. Journal of neuroscience methods 164(1): 177-190.

McClintock SM, Freitas C, Oberman L, Lisanby SH, Pascual-Leone A (2011). Transcranial magnetic stimulation: a neuroscientific probe of cortical function in schizophrenia. Biol Psychiatry 70(1): 19-27.

McDonnell MN, Orekhov Y, Ziemann U (2006). The role of GABA(B) receptors in intracortical inhibition in the human motor cortex. Experimental brain research 173(1): 86-93.

Miller MD, Paradis CF, Houck PR, Mazumdar S, Stack JA, Rifai AH, et al (1992). Rating chronic medical illness burden in geropsychiatric practice and research: application of the Cumulative Illness Rating Scale. Psychiatry Res 41(3): 237-248.

Patel AB, de Graaf RA, Martin DL, Battaglioli G, Behar KL (2006). Evidence that GAD65 mediates increased GABA synthesis during intense neuronal activity in vivo. Journal of neurochemistry 97(2): 385-396.

Peng H, Zheng H, Li L, Liu J, Zhan B, et al (2012). High-frequency rTMS treatment increases white matter FA in the left middle frontal gyrus in young patients with treatmentresistant depression. Journal of affective disorders 136(3): 249-257.

Pirkola T, Tuulio-Henriksson A, Glahn D, Kieseppa T, Haukka J, Kaprio J, et al (2005). Spatial working memory function in twins with schizophrenia and bipolar disorder. Biol Psychiatry 58(12): 930-936.

Radhu N, Garcia Dominguez L, Farzan F, Richter MA, Semeralul MO, Chen R, et al (2015). Evidence for inhibitory deficits in the prefrontal cortex in schizophrenia. Brain 138(Pt 2): 483-497.

Rogasch NC, Daskalakis ZJ, Fitzgerald PB (2014). Cortical inhibition of distinct mechanisms in the dorsolateral prefrontal cortex is related to working memory performance: A TMS-EEG study. Cortex 64C: 68-77.

Rossi S, Hallett M, Rossini PM, Pascual-Leone A, Safety of TMSCG (2009). Safety, ethical considerations, and application guidelines for the use of transcranial magnetic stimulation in clinical practice and research. Clinical neurophysiology : official journal of the International Federation of Clinical Neurophysiology 120(12): 2008-2039.

Schizophrenia Working Group of the Psychiatric Genomics C (2014). Biological insights from 108 schizophrenia-associated genetic loci. Nature 511(7510): 421-427.

Straub RE, Lipska BK, Egan MF, Goldberg TE, Callicott JH, Mayhew MB, et al (2007). Allelic variation in GAD1 (GAD67) is associated with schizophrenia and influences cortical function and gene expression. Mol Psychiatry 12(9): 854-869.

Thompson PM, Cannon TD, Narr KL, van Erp T, Poutanen VP, Huttunen M, et al (2001). Genetic influences on brain structure. Nature neuroscience 4(12): 1253-1258.

Torrey EF, Barci BM, Webster MJ, Bartko JJ, Meador-Woodruff JH, Knable MB (2005). Neurochemical markers for schizophrenia, bipolar disorder, and major depression in postmortem brains. Biol Psychiatry 57(3): 252-260.

Uhlhaas PJ, Singer W (2010). Abnormal neural oscillations and synchrony in schizophrenia. Nat Rev Neurosci 11(2): 100-113.

Voineskos AN, Rajji TK, Lobaugh NJ, Miranda D, Shenton ME, Kennedy JL, et al (2012). Agerelated decline in white matter tract integrity and cognitive performance: a DTI tractography and structural equation modeling study. Neurobiology of aging 33(1): 21-34.

Wechsler D (2001). Wechsler Test of Adult Reading: WTAR Psychological Corporation.

#### Tables

| Controls (N= 115) |           | Schizophrenia (N = 80) |           |      |       |
|-------------------|-----------|------------------------|-----------|------|-------|
| Mean              | SD        | Mean                   | SD        | t193 | P     |
| 46.79             | 19:32     | 45.49                  | 16.00     | 0.49 | 0.63  |
| 117.92            | 8.11      | 110.64                 | 15.16     | 4.24 | <0.05 |
| 15.32             | ી તેર     | 13.25                  | 2.64      | 6.27 | <0.05 |
| 5.16              | 1.81      | 4.18                   | 2.26      | 3.38 | <0.05 |
|                   |           |                        |           |      |       |
| Count             | Frequency | Count                  | Frequency | x2   | p     |
| 105               | 92.1%     | 71                     | 89.9%     | 0.23 | 0.59  |
| 61                | 53.0%     | 48                     | 60.0%     | 0.93 | 0.38  |
|                   |           |                        |           |      |       |

Table 1. Demographics of imaging-genetics sample

Table 2. The association between working memory related tasks and GAD1 rs3749034 genotype, diagnosis, and their interaction. 

| C    |  |                                  |  |                                   |                                                                                                 |  |  |  |  |
|------|--|----------------------------------|--|-----------------------------------|-------------------------------------------------------------------------------------------------|--|--|--|--|
| GADI |  | Diagnosis                        |  | GAD1*Diagnosis                    |                                                                                                 |  |  |  |  |
|      |  |                                  |  | F1,188                            | P                                                                                               |  |  |  |  |
|      |  |                                  |  |                                   | 0.091                                                                                           |  |  |  |  |
|      |  |                                  |  | 0.02                              | 0.89                                                                                            |  |  |  |  |
|      |  |                                  |  |                                   | 0.68                                                                                            |  |  |  |  |
|      |  |                                  |  | 2.50                              | 0.12                                                                                            |  |  |  |  |
|      |  | Working Memory Task   F1,188   P |  | F1.188 P<br>7.97 0.005 5.06 0.026 | 5.03   0.026   18.04   <0.0001   2.89<br>1.17 0.28 24.41 <0.0001 0.17<br>7.03 0.009 12.50 0.001 |  |  |  |  |

\*\*Covariates included in the model include age (46.3 years), and Wechsler Test of Adult Reading (WTAR) performance (115.1).

#### Figure Legends

Figure 1. GADI rs3749034 risk T-allele predicts lower TBSS skeleton white matter FA in healthy controls (N=115) and patients with schizophrenia (N=80). There was a significant main effect of GADI genotype on prefrontal FA, and no sigmificant effect of GADI genotype-bydiagnosis interaction. Areas in yellow correspond to p<0.05 after correction for family-wise error. Green represents the mean FA skeleton overlaid on the FMRIB58\_FA standard space image. FA, fractional anisotropy, TBSS, tract-based spatial statistics.

Figure 2. Skeletal white matter FA regions that mediate the effect of GADI rs3749034 on digitspan forward performance. Significant p-values indicated broad areas of the white matter skeleton FA that mediated the effect of GADI risk T-allele risk genotype on poor digit-span performance. We created a z-statistic from voxel-wise Sobel tests for mediation based on the beta coefficients and standard error from (i) GADI regressed on TBSS skeleton FA (Figure 1), and (ii) TBSS skeleton FA regressed on digit-span performance (Figure S2). The z-values then underwent threshold free clustering enhancement, and p-values are derived using permutation testing (N=10000). Areas in yellow correspond to p<0.05 after correction for family-wise error. Green represents the mean FA skeleton overlaid on the FMRIB58, FA standard space image. FA, fractional anisotropy, TBSS, tract-based spatial statistics.

Figure 3. The effect of GAD1 rs3749034 genotype on LICI cluster size in healthy control (n=33) and patients with schizophrenia (n=23) undergoing TMS-EEG stimulation to the DLPFC. Blue and red represent healthy controls and schizophrenia patients, respectively. Hollow circles represent each subject with C-allele homozygotes and solid circles represent each carriers of the T-allele. Mean and 95% confidence intervals for each group are to the immediate right. DLPFC LICI cluster size has been log transformed and corrected for age (35.5 years). There is significant genotype-by-diagnosis interaction (F1,56-14.3, p=4.1x10-1). Healthy control C-allele homozygotes (n=20, mean: 4.56±0.52) have lower DLPFC LICI cluster size than T allele carriers (n=13, mean±sd: 5.08±0.30; F1.33=10.1, p=0.003). Schizophrenia patients that are C-allele homozygotes (n=10, 4.94±0.34) have higher DLPFC LICI cluster size than T-allele carriers (n=13, 4.51±0.53; F1.22=4.8, p=0.4). CNT, healthy control; DLPFC, dorsolateral prefrontal cortex. SCZ, patients with schizophrenia; sd, standard deviation; TMS-EGG, transcranial magnetic stimulation with electroencephalography.

![](1__page_25_Picture_0.jpeg)

Z=100

Z=110

Z=120

Z=90

.00

.01

.02

.03

.04

.05

. | © 2016 Macmillan Publishers Limited. All rights reserved.

![](1__page_26_Figure_0.jpeg)

![](1__page_26_Picture_1.jpeg)

Z=100

Z=110

Z=120

Z=90

.00

.01

.02

.03

.04

.05

- ' '

![](1__page_27_Figure_0.jpeg)"
